S_ID,Strategy / Capability,Action,Description,Scale,Category,Category2,Strategy_Type,Adj_Weight,Strategy_Type2,R1A,R1B,R2A,R2B,R3A,R3B,R4A,R4B,R5A,R5B,Rcount,Rs
1,Backup Power Conversion to Dual-fuel (Building Level),Convert Existing Backup Power to Dual-fuel (Building Level),"Generators that can run on two or more fuel types (e.g., diesel, natural gas) have greater flexibility than single-fuel generators in providing backup power if the fuel supply is disrupted. The goal of this strategy is to ensure that generators covering critical building loads have the capability to use multiple fuel types. Note that Jet Propellant 8 (JP-8) is not considered a dual fuel for diesel because using JP-8 requires modifying fuel injectors and because the extended use of JP-8 requires modifying maintenance schedules.",Building,Backup Power,NULL,Dual-fuel,5,Dual-fuel,,,NULL,1,NULL,1,NULL,1,NULL,NULL,3,"R2B R3B R4B "
2,Minimum Generator Loading,Adjust Generator Size to Avoid Wet Stacking,"A generator is considered right-sized if it operates at between 30 and 70% rated capacity. Diesel generators that run below 30% load do not reach the required engine temperature to fully combust fuel, resulting in wet stacking (i.e., unburned fuel passes into the exhaust system). Wet stacking increases maintenance and can cause permanent engine damage. Adjusting generator size to avoid wet stacking helps ensure that generators have at least a 30% load at all times, which can be accomplished by replacing oversized generators with lower capacity generators, increasing the connected load, or using load banks. Generators that operate at over 70% rated capacity are considered undersized and are addressed in Strategy 7, Backup Power for Critical Loads.",Building,Backup Power,NULL,Generator Testing,3,Install Backup System,NULL,NULL,NULL,1,NULL,1,NULL,1,NULL,NULL,3,"R2B R3B R4B "
3,Generator Full-Load Testing (Building Level),Conduct Generator Full-Load Testing (Building Level),"Regularly testing generators at their full-load capacity identifies operational issues that may arise during an emergency, removes buildup from wet stacking, and extends the generator’s usable life. This strategy helps ensure that backup power generators are tested at their full capacity. Load banks may be required for full-load testing when the full-load capacity exceeds the connected load. This strategy applies to building-level generators.",Building,Backup Power,NULL,Generator Testing,3,Generator Testing,,,NULL,1,NULL,1,NULL,1,NULL,NULL,3,"R2B R3B R4B "
4,Generator Hard-Drop Testing (Building Level),Conduct Generator Hard-Drop Testing (Building Level),"During an outage or emergency, the backup power for a building should be reliable and function properly. Testing backup power by cutting utility power to a building can determine whether the power transfer systems work correctly and whether all critical loads are properly connected to the backup power. This strategy applies to building-level generators.",Building,Backup Power,NULL,Generator Testing,4,Generator Testing,NULL,NULL,NULL,1,NULL,1,NULL,1,NULL,NULL,3,"R2B R3B R4B "
5,Backup Power Systems in Secure Structure,Locate Backup Power Systems in Secure Structure,"Backup power systems may be subject to damage from physical threats, especially weather-related events, but must still be fully functional when required. Locating backup power systems within a secure structure helps protect them from physical threats. The definition of secure structure depends on local conditions, threats, and the system. This strategy relates to Strategy 24, Hardened Electrical Distribution Components.",Building,Backup Power,NULL,Infrastructure Hardening,3,Infrastructure Hardening,,NULL,NULL,NULL,NULL,NULL,NULL,NULL,NULL,NULL,1,"R1B "
6,Generator Cold Weather Block Heater,Install Generator Cold Weather Block Heater,Generators may have fast-starting requirements but may not operate at full capacity in a cold climate. Block heaters help keep generators warm so they can start quickly in an outage.,Building,Backup Power,NULL,Infrastructure Hardening,1,Infrastructure Hardening,,NULL,NULL,1,NULL,NULL,NULL,1,NULL,NULL,3,"R1B R2B R4B "
7,Backup Power for Critical Loads (Building Level),Install Backup Power for Critical Loads (Building Level),"Uninterruptable critical infrastructure should have a reliable source of power even in unpredictable events. Backup systems ensure that supply failure will not compromise an uninterruptable critical asset/function. Generators that are undersized to serve critical loads should be addressed here rather than in Strategy 2, Minimum Generator Loading, because an undersized generator could be undersized because not all critical loads are connected. Critical loads are required to have backup power per AFMAN 32-1062. This strategy does not include UPS systems, which are captured in Strategy 9, Critical Load UPS System.",Building,Backup Power,NULL,Install Backup System,5,Install Backup System,,,NULL,1,NULL,1,NULL,1,NULL,NULL,3,"R2B R3B R4B "
8,Backup Power for Other Loads / HVAC (Building Level),Install Backup Power for Other Loads / HVAC (Building Level),"Backup power systems should be fully functional when required. Backup power for loads that are beyond the loads required in AFMAN 32-1062, which may include mission-specified loads, reduces mission degradation. For example, while sustaining HVAC loads may not be required, doing so may improve mission function.",Building,Backup Power,NULL,Install Backup System,3,Install Backup System,,,NULL,1,NULL,1,NULL,1,NULL,NULL,3,"R2B R3B R4B "
9,Critical Load UPS System (Building Level),Install/Upsize UPS System (Building Level),"Some critical loads, such as server racks, require uninterrupted power. The goal of this strategy is to install or upsize a UPS to adequately serve critical loads.",Building,Backup Power,NULL,Install Backup System,5,Install Backup System,,,NULL,NULL,NULL,1,NULL,1,NULL,NULL,2,"R3B R4B "
10,Portable Generator Quick-Connect (Building Level),Install Portable Backup Power Tie-in Connection (Building Level),"A quick-connect port connects mobile generators to mission-essential loads as designated by the installation. Even if a mission is not authorized for an Equipment Authorized Inventory Data (EAID) generator under AFMAN 32-1062, a facility can install a quick-connect to the switchboard, especially if the facility is being designed or renovated.",Building,Backup Power,NULL,Install Backup System,3,Install Backup System,,,NULL,1,NULL,1,NULL,NULL,NULL,NULL,3,"R2A R2B R3B "
11,Centralized Backup Power (District Level),Centralize Backup Power (District Level),"Backup power systems should be fully functional when required. Centralizing backup power systems at the district level helps realize improved operations and maintenance (O&M) and fuel efficiencies. An example is a cluster of buildings that all require backup power, and each one has significantly oversized and/or redundant generators. Note that centralized generators are typically designed to operate for longer runtimes than facility-level generators.",District,Backup Power,NULL,Centralized Systems,5,Centralized Systems,,,NULL,1,NULL,1,NULL,1,NULL,NULL,3,"R2B R3B R4B "
12,Centralized Dual-fuel Backup Power (District Level),Install Centralized Dual-fuel Backup Power (District Level),"Backup power systems should be fully functional when required. Centralizing backup power systems at the district level helps realize improved O&M and fuel efficiencies, and enabling generators to run on two or more fuel types (e.g., diesel, natural gas) increases flexibility for providing backup power in the event of a disruption to the fuel supply. Note that Jet Propellant 8 (JP-8) is not considered a dual fuel for diesel because using JP-8 requires modifying fuel injectors and because the extended use of JP-8 requires modifying maintenance schedules.",District,Backup Power,NULL,Centralized Systems,5,Centralized Systems,,,NULL,1,NULL,1,NULL,1,NULL,NULL,4,"R2A R2B R3B R4B "
13,Backup Power Conversion to Dual-fuel (District Level),Convert Existing Backup Power to Dual-fuel (District Level),"Generators that can run on two or more fuel types (e.g., diesel, natural gas) have greater flexibility than single-fuel generators in providing backup power if the fuel supply is disrupted. The goal of this strategy is to ensure that generators covering critical facility loads at the district level have the capability to use multiple fuel types. Note that Jet Propellant 8 (JP-8) is not considered a dual fuel for diesel because using JP-8 requires modifying fuel injectors and because the extended use of JP-8 requires modifying maintenance schedules.",District,Backup Power,NULL,Dual-fuel,3,Dual-fuel,,,NULL,1,NULL,1,NULL,1,NULL,NULL,4,"R2A R2B R3B R4B "
14,Priority Generator Fueling Protocol,Establish Priority Generator Fueling Protocol,"In an installation-wide and long-term outage, all generators across the base will need regular refueling. A refueling schedule would allow tracking how often each generator needs to be refueled. Additionally, prioritizing generators can determine which ones need to stay fueled at all times and which ones can run dry if refueling capabilities are constrained due to equipment, workforce, or fuel supply shortages.",Installation,Backup Power,NULL,Emergency Protocols,3,Emergency Protocols,,,NULL,NULL,NULL,NULL,NULL,NULL,NULL,NULL,2,"R4A R5A "
15,Centralized Generator Full-Load Testing (District Level),Test Generators Using Full Existing Loads (Installation Level),"When generators are tested, the full critical load (circuit or building) should be tested. Loads should not be shed during tests, and tests should not be conducted during off-hours. Load banks can be installed in generators that are large enough for load banks and can be used to test the full capacity of the generator beyond the critical load to help ensure that the generators are reliable for the required full load. This strategy applies to centralized generators at the district level.",District,Backup Power,NULL,Generator Testing,3,Generator Testing,,,NULL,1,NULL,1,NULL,1,NULL,NULL,3,"R2B R3B R4B "
16,Centralized Generator Hard-Drop Testing (District Level),Conduct Generator Hard-Drop Testing (Installation Level),"During an outage or emergency, the backup power for a district should be reliable and function properly. Testing backup power by cutting utility power to the installation can determine whether the power transfer systems work correctly and whether all critical loads are properly connected to the backup power. This strategy applies to centralized generators at the district level.",District,Backup Power,NULL,Generator Testing,4,Generator Testing,NULL,NULL,NULL,1,NULL,1,NULL,1,NULL,NULL,3,"R2B R3B R4B "
17,Backup Power for Fuel Pumps,Connect Backup Power Source for Fuel Pumps,"Fuel pumps may be in place for pumping fuel from bulk storage to aircraft or fleet or for generator refueling. These fueling operations may be considered critical operations and, if so, would need backup power so the operations could be sustained through an outage.",Installation,Backup Power,NULL,Install Backup System,3,Procurement,,,NULL,1,NULL,1,NULL,1,NULL,NULL,3,"R2B R3B R4B "
18,Backup Power for Security Assets,Install Backup Power for Security Assets (Building Level),"Security assets should have a reliable source of power even during unpredictable events. Backup power systems ensure that supply failure does not compromise uninterruptable security assets or functions, such as installation gates and perimeter security systems.",Installation,Backup Power,NULL,Install Backup System,4,Install Backup System,NULL,NULL,NULL,1,NULL,1,NULL,1,NULL,NULL,3,"R2B R3B R4B "
19,Backup Generator Refueling Logistics,Procure/Increase Diesel Refueling Truck Capacity,"In an installation-wide and long-term outage, refueling capabilities can be constrained by a lack of refueling equipment or a refueling prioritization plan, resulting in failure of backup power or heating systems. Procuring additional fueling trucks and/or increasing the capacity of existing equipment would resolve inadequate refueling capabilities.",Installation,Backup Power,NULL,Procurement,4,Procurement,,,NULL,NULL,NULL,1,NULL,NULL,NULL,NULL,3,"R2A R3B R5B "
20,Portable Backup Power Generators,Procure Portable Backup Power Generators,"The installation should have an adequate inventory of portable generators to meet its needs. Facilities should have connection points ready to receive a portable generator (Strategy 10, Portable Generator Quick-Connect (Building Level)). The number of available portable generators across the installation should be verified to be adequate for loads that would benefit from backup power capability but that do not qualify for real property generators.",Installation,Backup Power,NULL,Procurement,3,Procurement,,,NULL,1,NULL,1,NULL,1,NULL,NULL,3,"R2B R3B R4B "
21,Alternate Supply Paths (Backup Power),Mitigate Single Points of Failure (Backup Power),"Backup power systems can have a single point of failure. For example, a redundant generator but only one UPS is a single point of failure and represents a degradation of power availability. Requiring redundancy through all stages of the backup power system ensures that there are no single points of failure associated with the provision of backup power.",Installation,Backup Power,NULL,Single Points of Failure,5,Single Points of Failure,NULL,NULL,NULL,NULL,NULL,NULL,NULL,NULL,NULL,NULL,1,"R2A "
22,Alternate Cooling Generation (Building Level),Change the Type of Cooling Generation Source (Building Level),"A building may only have one source of cooling energy during an outage. Establishing an alternate source of cooling energy at a building level reduces reliance on one type of system during an outage. For example, in the server room, a computer room air conditioning (CRAC) system can operate as a backup system for the room as well as potentially for the building by leaving the server door open.",Building,Building Systems,NULL,Alternative System or Fuel,2,Alternative System or Fuel,,,NULL,1,NULL,NULL,NULL,NULL,NULL,NULL,3,"R2B R5A R5B "
23,Alternate Heat Generation (Building Level),Change the Type of Heat Generation Source (Building Level),"A building may only have one source of heating fuel energy during an outage. Diversifying the heating fuel source reduces reliance on a single supply line or system. This strategy includes installing or upgrading building heating systems to work with multiple fuels or systems (e.g., installing both a natural gas boiler system and electric heating for localized critical loads).",Building,Building Systems,NULL,Alternative System or Fuel,2,Alternative System or Fuel,,,NULL,1,NULL,NULL,NULL,NULL,NULL,NULL,3,"R2B R5A R5B "
24,Hardened Electrical Distribution Components (Installation Level),Add Physical Protection to Electrical Distribution Components (Installation Level),"Certain components of electrical distribution systems (e.g., switches, transformers) may be at risk of physical damage from day-to-day activities at an installation. This strategy involves placing physical protection around these components to prevent accidental damage by, for example, installing ground-level transfer switches that can be protected by bollards to prevent damage from vehicles.",Installation,Power Distribution,NULL,Infrastructure Hardening,3,Infrastructure Hardening,,NULL,NULL,NULL,NULL,NULL,NULL,NULL,NULL,NULL,1,"R1B "
25,Simplified HVAC Systems (Reduced Component Failure),Simplify HVAC Systems (Reduced Component Failure),"Some facilities have undergone ad hoc retrofits over many years, resulting in an assortment of HVAC system types and ages that serve different zones. Simplifying and consolidating systems can reduce the number of vulnerable components and reduce O&M costs.",Building,Building Systems,NULL,Building Retrofits,1,Building Retrofits,,NULL,NULL,NULL,NULL,NULL,NULL,NULL,NULL,NULL,2,"R5A R5B "
26,Thermal Energy Storage (Building Level),Install Thermal Energy Storage (Building Level),"Buildings are subject to outages during unpredictable events. Having the capability to store thermal energy (e.g., ice, chilled water, hot water storage) at the building level can provide backup supply during outages and be used to reduce peak load, save energy costs, and reduce the design requirements for primary and backup power, helping the facility reach its required sustainment capacity.",Building,Energy Storage,NULL,Energy Storage,2,Alternative System or Fuel,,,NULL,1,NULL,1,NULL,NULL,NULL,NULL,3,"R2B R3A R3B "
27,Cooling Capacity for Critical Loads (Building Level),Increase Cooling System Capacity (Building Level),"Insufficient cooling capacity for critical loads, especially during heat waves, can make work environments nonviable for personnel and can damage equipment. Ensuring that the facility’s HVAC system has sufficient cooling capacity helps meet all facility critical cooling loads (e.g., servers, critical personnel, process cooling).",Building,Building Systems,NULL,Increased System Capacity,3,Increased System Capacity,,,NULL,NULL,NULL,1,NULL,NULL,NULL,NULL,1,"R3B "
28,Heating Capacity for Critical Loads (Building Level),Increase Heating System Capacity (Building Level),"Insufficient heating capacity for critical loads, especially during cold spells, can make work environments nonviable for personnel and can damage equipment. Ensuring that the facility’s HVAC system has sufficient heating capacity helps meet all facility critical heating loads (e.g. climate controlled storage, critical personnel, process heating).",Building,Building Systems,NULL,Increased System Capacity,3,Increased System Capacity,,,NULL,NULL,NULL,1,NULL,NULL,NULL,NULL,1,"R3B "
29,Water Intrusion and Flood Risk Mitigation (Building Level),Raise or Relocate Critical Equipment (Building Level),"Buildings are susceptible to flood damage. Locating critical equipment below expected flood levels (e.g., in a basement) can increase the likelihood of water damage. Additionally, water intrusion through the building envelope during rain events can damage critical equipment such as servers. Water intrusion through storm/sanitary sewer drain blockages can further cause mission disruption if sewage backs up into sensitive equipment or critical operations rooms. Raising the elevation of critical equipment to above the expected flood level and addressing critical water intrusion issues can avoid such damage.",Building,Other,NULL,Infrastructure Hardening,3,Infrastructure Hardening,,NULL,NULL,NULL,NULL,NULL,NULL,NULL,NULL,NULL,1,"R1B "
30,Portable HVAC System Tie-in Connection (Building Level),Install Portable HVAC System Tie-in Connection (Building Level),"If a facility has a critical heating or cooling load, providing a backup heating or cooling system will ensure that the loads can be met in case of equipment or system failure. If a load is not deemed so critical that it requires a permanent backup system but equipment failure would cause mission degradation, enabling a tie-in connection for a portable backup system (such as a chiller or boiler) can provide sufficient redundancy at lower cost.",Building,Building Systems,NULL,Install Backup System,1,Install Backup System,,NULL,NULL,1,NULL,1,NULL,NULL,NULL,NULL,4,"R2B R3B R4A R5B "
31,Portable Backup HVAC Systems (Building Level),Procure Portable Backup HVAC Systems (Building Level),The required capacity of building HVAC systems varies. Portable HVAC systems such as chillers and boilers of different sizes can adequately meet the variable capacity demands across the installation. Portable HVAC systems require a portable HVAC system tie-in.,Building,Building Systems,NULL,Procurement,1,Procurement,,,NULL,NULL,NULL,1,NULL,NULL,NULL,NULL,2,"R3B R5B "
32,Dedicated Electrical Circuit for Critical Loads (Building Level),Install a Dedicated Electrical Circuit for Critical Loads (Building Level),"Critical loads of a building must be met during unpredictable events. Dedicating an electrical circuit for critical loads in a facility can enable the isolation of critical loads when providing backup power. If not all loads within a facility are critical, configuring the backup power system so it powers just the critical circuits can lower the required sustainment capacity and extend the time frame during which loads can be supported in an outage.",Building,Power Distribution,NULL,Single Points of Failure,4,Single Points of Failure,,,NULL,NULL,NULL,1,NULL,NULL,NULL,NULL,2,"R2A R3B "
33,Redundant HVAC Systems for Critical Loads (Building Level),Install Redundant HVAC Systems for Critical Loads (Building Level),"If a facility has a critical heating or cooling load, ensuring redundancy in the heating or cooling system can mitigate the impact of equipment or source failure. For example, installing extra CRAC units provides redundant cooling capacity in a critical server room.",Building,Building Systems,NULL,Single Points of Failure,5,Single Points of Failure,,,NULL,1,NULL,1,NULL,NULL,NULL,NULL,3,"R2B R3B R5B "
34,Alternate Cooling Generation (District Level),Change the Type of Cooling Generation Source (District Level),"A district may have only one source of cooling energy during an outage. Establishing an alternate source of cooling energy at the district level reduces reliance on one type of system during an outage (e.g., capturing wasted cooling from LNG or propane storage, natural gas / steam adsorption chillers as an alternative to electric chillers).",District,Building Systems,NULL,Alternative System or Fuel,1,Alternative System or Fuel,,,NULL,1,NULL,1,NULL,NULL,NULL,NULL,3,"R2B R3B R5B "
35,Alternate Heat Generation (District Level),Change the Type of Heat Generation Source (District Level),"A district may have only one source of heating fuel energy during an outage. Diversifying the heating fuel source reduces reliance on a single supply line. This strategy includes installing or upgrading heating systems at the district level that can operate with multiple fuels or systems (for example, installing electric heat pumps and boilers that can operate on both natural and propane gas).",District,Building Systems,NULL,Alternative System or Fuel,1,Alternative System or Fuel,,,NULL,1,NULL,1,NULL,NULL,NULL,NULL,3,"R2B R3B R5B "
36,Centralized Cooling System (District Level),Install a Centralized District-level Cooling System (District Level),"A centralized cooling system consists of a central plant that generates chilled water that serves connected facilities. Centralizing cooling systems at a district level can improve redundancy for critical loads when coupled with a localized cooling source. Centralizing cooling systems also consolidates and reduces the primary equipment that must be maintained, potentially easing preventative maintenance and reducing the critical sustainment capacity requirement.",District,Building Systems,NULL,Centralized Systems,2,Centralized Systems,,,NULL,NULL,NULL,NULL,NULL,NULL,NULL,NULL,2,"R3A R5A "
37,Centralized Heating System (District Level),Install a Centralized District-level Heating System (District Level),"A centralized heating system consists of a central plant that generates hot water or steam that serves connected facilities. Centralizing heating systems at a district level can improve redundancy when coupled with a localized heating source. Centralizing heating systems also consolidates and reduces the primary equipment that must be maintained, potentially easing preventative maintenance and reducing the critical sustainment capacity requirement.",District,Building Systems,NULL,Centralized Systems,2,Centralized Systems,,,NULL,NULL,NULL,NULL,NULL,NULL,NULL,NULL,2,"R3A R5A "
38,Thermal Energy Storage (District Level),Install Thermal Energy Storage (District Level),"Buildings are subject to outages during unpredictable events. Having the capability to store thermal energy (e.g., ice, chilled water, hot water storage) can provide backup supply during an outage and also be used to reduce peak load, save energy costs, reduce peak capacity requirements, and help the facility reach its required sustainment capacity. This strategy requires a centralized cooling or heating system at the district level.",District,Energy Storage,NULL,Energy Storage,2,Alternative System or Fuel,,,NULL,1,NULL,1,NULL,NULL,NULL,NULL,3,"R2B R3A R3B "
39,Cooling System Capacity (District Level),Increase Cooling System Capacity (District Level),Having a centralized cooling system with sufficient capacity increases the available cooling supply in the event of a localized equipment fault.,District,Building Systems,NULL,Increased System Capacity,2,Increased System Capacity,,,NULL,NULL,NULL,1,NULL,NULL,NULL,NULL,1,"R3B "
40,Heating System Capacity (District Level),Increase Heating System Capacity (District Level),Having a centralized heating system with sufficient capacity increases the available heating supply in the event of a localized equipment fault.,District,Building Systems,NULL,Increased System Capacity,2,Increased System Capacity,,,NULL,NULL,NULL,1,NULL,NULL,NULL,NULL,1,"R3B "
41,Alternate Cooling Generation (Installation Level),Change the Type of Cooling Generation Source (Installation Level),"Installations are subject to outages during unpredictable events. Establishing an alternate source of cooling energy at an installation level reduces reliance on one type of system during an event (e.g., capturing wasted cooling from LNG or propane storage, natural gas / steam adsorption chillers as an alternative to electric chillers). An alternate source of cooling energy is applicable only if the installation is served by one or more central cooling plants.",Installation,Building Systems,NULL,Alternative System or Fuel,1,Alternative System or Fuel,,,NULL,1,NULL,1,NULL,NULL,NULL,NULL,3,"R2B R3B R5B "
