S_ID,Strategy / Capability,Action,Description,Scale,Category,Category2,Strategy_Type,Adj_Weight,Strategy_Type2,R1A,R1B,R2A,R2B,R3A,R3B,R4A,R4B,R5A,R5B,Rcount,Rs
42,Alternate Heat Generation (Installation Level),Change the Type of Heat Generation Source (Installation Level),"Installations are subject to outages during unpredictable events. Diversifying the heating fuel source reduces reliance on a single supply line or system. This strategy includes installing or upgrading heating systems across the installation that operate with multiple fuels (for example, installing electric heat pumps and boilers that can operate on both natural and propane gas).",Installation,Building Systems,NULL,Alternative System or Fuel,1,Alternative System or Fuel,,,NULL,1,NULL,1,NULL,NULL,NULL,NULL,3,"R2B R3B R5B "
43,Centralized Cooling System (Installation Level),Install a Centralized Installation-level Cooling System (Installation Level),"A centralized cooling system consists of a central plant that generates chilled water that serves connected facilities. Centralizing cooling systems at an installation level can improve redundancy for critical loads when coupled with localized cooling sources. Centralizing cooling systems also consolidates and reduces the primary equipment that must be maintained, potentially easing preventative maintenance and reducing the critical sustainment capacity requirement.",Installation,Building Systems,NULL,Centralized Systems,2,Centralized Systems,,,NULL,NULL,NULL,NULL,NULL,NULL,NULL,NULL,2,"R3A R5A "
44,Centralized Heating System (Installation Level),Install a Centralized Installation-level Heating System (Installation Level),"A centralized heating system consists of a central plant that generates hot water or steam that serves connected facilities. Centralizing heating systems at an installation level can improve redundancy when coupled with localized heating sources. Centralizing heating systems also consolidates and reduces the primary equipment that must be maintained, potentially easing preventative maintenance and reducing the critical sustainment capacity requirement.",Installation,Building Systems,NULL,Centralized Systems,2,Centralized Systems,,,NULL,NULL,NULL,NULL,NULL,NULL,NULL,NULL,2,"R3A R5A "
45,Alternate Communications Connection or System,Install Alternative Communications Connection or System,Building communications systems are subject to failure during unpredictable events. Establishing alternate communications routes for energy systems provides a backup control route if a primary system is compromised.,Building,Controls & COMS,NULL,Alternative System or Fuel,4,Alternative System or Fuel,NULL,,NULL,NULL,NULL,NULL,NULL,NULL,NULL,NULL,4,"R1A R2A R4A R5A "
46,Building Systems Monitoring,Install Systems Monitoring Equipment,Monitoring a building’s energy system performance allows localized response to issues and optimization opportunities. Monitoring can identify equipment that is compromised and resources whose consumption could be reduced.,Building,Controls & COMS,NULL,Energy Management,3,Cybersecurity,NULL,,NULL,NULL,NULL,NULL,NULL,NULL,NULL,NULL,3,"R1A R4A R5A "
47,Energy Management and Control Systems (EMCS) (Building Level),Install/Expand Energy Management Control Systems (Building Level),"Rapid response time and sustainment of critical loads of buildings must be consistent. Installing an EMCS allows monitoring and controlling energy systems at a building level, which can enhance response time to system issues and increase sustainment time by curtailing noncritical loads.",Building,Energy Management,NULL,Energy Management,3,Energy Management,NULL,,NULL,NULL,NULL,NULL,NULL,1,NULL,NULL,4,"R1A R3A R4B R5A "
48,Isolated Communications Strands / Zones,Isolate Communications Strands / Zones,"Isolating energy communications networks from other base communications networks improves the security of both. If one system is compromised, the separation can protect the other. This strategy focuses on the segregation of SCADA/energy systems from the rest of the base communications network to mitigate hacking vulnerability. Virtual Local Area Networks (VLANs) are acceptable, such as a Community of Interest Network Enclave (COINE) network.",Installation,Controls & COMS,NULL,Cybersecurity,4,Cybersecurity,NULL,NULL,NULL,NULL,NULL,NULL,NULL,1,NULL,NULL,2,"R1A R4B "
49,Priority Load-Shedding Protocol,Establish a Priority Load-shedding Protocol,"If the installation is facing a power outage or energy supply shortage, critical energy demands will need to be met while noncritical demands can be shed. This strategy involves prioritizing critical energy demands to establish an order in which loads can be shed in the event of limited electricity supply.",Installation,Controls & COMS,NULL,Emergency Protocols,3,Emergency Protocols,,,NULL,NULL,NULL,NULL,NULL,NULL,NULL,NULL,2,"R3A R4A "
50,Centralized Emergency Operations Center (EOC),Establish a Centralized EOC,"During an unpredictable event, critical personnel should have an established centralized location for the active monitoring of system data and response coordination, which would be in an EOC that is staffed 24/7/365. For the monitoring to be fully effective, a base-wide SCADA system is required.",Installation,Other,NULL,Cybersecurity,2,Cybersecurity,NULL,,NULL,NULL,NULL,NULL,NULL,NULL,NULL,NULL,2,"R4A R5A "
51,Communications Network Encryption,Encrypt Communications Network,Installations are subject to cyberattacks. Adding sufficient encryption to the energy communications networks allows additional protection from cyberattacks.,Installation,Controls & COMS,NULL,Cybersecurity,5,Cybersecurity,NULL,,NULL,NULL,NULL,NULL,NULL,NULL,NULL,NULL,1,"R1A "
52,Installation-wide SCADA System (Energy),Install/Upgrade Base-Wide SCADA System (Energy),"SCADA systems for energy allow personnel to monitor and, if necessary, operate all of the installation’s energy systems from a single terminal and/or remotely. SCADA systems can reduce workforce needs, allow rapid identification of equipment failures, and speed recovery from failures. SCADA systems require appropriate cybersecurity measures.",Installation,Controls & COMS,NULL,Energy Management,3,Energy Management,NULL,,NULL,NULL,NULL,NULL,NULL,1,NULL,NULL,3,"R1A R4B R5A "
53,Energy Management System Personnel,Assign Personnel to Energy Management Duties,Energy management systems help ensure that critical energy loads are sustained throughout the installation. Assigning personnel to monitor and review data from energy management systems and respond to identified issues improves system efficiency and reliability. This strategy is more effective when combined with installation-level management and control systems.,Installation,Energy Management,NULL,Personnel Capacity,1,Personnel Capacity,NULL,,NULL,NULL,NULL,NULL,NULL,NULL,NULL,NULL,3,"R3A R4A R5A "
54,Alternate Supply Paths (Communications),Mitigate Single Points of Failure (Communications),"A single point of failure in the communications system means that failure at one point causes disruption to all downstream nodes. This strategy includes looping all communications lines that come from the base communications hub, interconnecting information transfer nodes, providing redundant conduits, and using other strategies that enable alternate communications routes if an element of the system fails.",Installation,Controls & COMS,NULL,Single Points of Failure,5,Single Points of Failure,NULL,NULL,NULL,NULL,NULL,NULL,NULL,NULL,NULL,NULL,3,"R1A R1B R2A "
55,Building Envelope Sealing (Building Level),Implement Building Envelope Sealing Strategies (Building Level),"Building envelope conditions can have a significant impact on the HVAC energy demand for a facility and during outages and can lengthen or shorten the amount time before personnel must evacuate the facility because of diminished thermal comfort (i.e., temperature drop or rise). Sealing the facility envelope reduces the flow of outdoor air seeping in through cracks and joints (e.g., doors, window frames) and corresponding required conditioning.",Building,ECMs,NULL,Building Retrofits,3,Building Retrofits,NULL,NULL,NULL,NULL,NULL,NULL,NULL,NULL,NULL,NULL,1,"R3A "
56,HVAC Performance Upgrades (Building Level),Upgrade HVAC Equipment to Increase Performance (Building Level),"Facilities are commonly found to have underperforming HVAC systems (heating and/or cooling). During normal operation, underperformance can cause mission degradation when certain zones are outside the required thermal range but must be occupied or are required for equipment operation. During outage conditions, any underperforming HVAC systems that are powered by backup systems may consume more energy than needed. Upgrading HVAC systems can improve mission performance and reduce backup power requirements.",Building,ECMs,NULL,Building Retrofits,1,Building Retrofits,,,NULL,NULL,NULL,NULL,NULL,NULL,NULL,NULL,1,"R3A "
57,Lighting Performance Upgrades (Building Level),Upgrade Lighting to Increase Performance (Building Level),"Reducing total electricity demand reduces the critical electricity demand, which in turn increases the sustainment capacity of existing backup power capacity and lowers the cost of proposed backup power capacity (both in terms of capacity and energy storage duration). Upgrading lighting (e.g., replacing fluorescent lamps with light-emitting diode [LED] lamps) can cost-effectively reduce electricity demand.",Building,ECMs,NULL,Building Retrofits,1,Building Retrofits,,,NULL,NULL,NULL,NULL,NULL,NULL,NULL,NULL,1,"R3A "
58,Plug Load Management (Building Level),Implement Plug Load Management Strategies (Building Level),"Backup power systems may power noncritical loads, which would decrease sustainment duration during outages. Managing and reducing plug load demand at a building level can increase sustainment duration during outages. This strategy includes installing switches at the equipment or circuit level to allow load shedding when required.",Building,Energy Management,NULL,Building Retrofits,1,Building Retrofits,NULL,,NULL,NULL,NULL,NULL,NULL,NULL,NULL,NULL,2,"R3A R4A "
59,System Recommissioning and Rebalancing (Building Level),Recommission Buildings (Building Level),"Over time, a facility’s HVAC equipment settings can deviate from the initial facility commissioning settings. Recommissioning the facility periodically (e.g., every 5 years) includes restoring the initial settings and making additional adjustments to the equipment, both of which can reduce energy demand and lengthen equipment lifespan at relatively low cost. Rebalancing a facility includes ensuring that the correct thermal flow is reaching the correct loads, especially if a facility has been repurposed from its original design. Rebalancing includes reducing or adding new controls and monitors where needed.",Building,ECMs,NULL,Building Retrofits,2,Building Retrofits,NULL,NULL,NULL,NULL,NULL,NULL,NULL,NULL,NULL,NULL,1,"R3A "
60,Energy Retrofit Projects (Installation Level),Implement Energy Retrofit Projects,"An installation’s energy performance should be improved if deficiencies are identified in order to optimize the consumption of resources. Energy retrofits such as installing better controls and scheduling, motor upgrades, and variable frequency drives on fans and pumps can improve energy performance. Reducing energy demand and improving control mitigate the strain on energy resources, thus improving critical load sustainment capacity and reducing the need for system capacity upgrades.",Installation,ECMs,NULL,Building Retrofits,2,Building Retrofits,,,NULL,NULL,NULL,NULL,NULL,NULL,NULL,NULL,1,"R3A "
61,Energy Management Protocol,Establish Energy Management Protocol,"Powering noncritical loads throughout the installation can decrease the amount of time that power is sustained during outages. Adopting installation-wide procedures that concentrate on reducing resource use increases the sustainment period during outage events. Following an independent third-party-validated energy management protocol such as ISO 50001, Energy Management, can benefit consistency and quality in the application of installation-wide procedures. Procedures can include a clearly defined response to identified system performance issues and energy education for tenants. This strategy is more effective if implemented in conjunction with an EMCS.",Installation,Energy Management,NULL,Emergency Protocols,3,Emergency Protocols,,,NULL,NULL,NULL,NULL,NULL,NULL,NULL,NULL,2,"R3A R4A "
62,Energy Demand Forecasting,Implement Electricity Demand Forecasting,"Forecasting energy demand allows for proactive adjustment to system operation and resource allocation to ensure energy cost-effectiveness. Establishing an effective mitigation plan can reduce identified gaps between forecasted load and available resources. Operationalizing energy resources for load balancing and islanding is captured in Strategies 116 and 127 (District Microgrid and Installation Microgrid, respectively).",Installation,ECMs,NULL,Energy Management,2,Energy Management,NULL,NULL,NULL,NULL,NULL,1,NULL,NULL,NULL,NULL,2,"R3A R3B "
63,Energy Demand Management - Peaker Plant,Install a Peaker Plant for Energy Demand Management,"Installations may want backup power but may not be able to secure financing to acquire it. Installing a peaker plant can provide cost savings to the installation and increase sustainment power capacity. Peaker plant generators are typically operated intermittently to reduce load on utility transmission lines, especially during peak times with high energy costs. This strategy focuses on energy cost savings but can be operationalized to provide power to critical installation loads during outages through a combination with other strategies such as Strategy 79 (Access to Alternate/Renewable Generation during an Outage) or Strategy 127 (Installation Microgrid).",Installation,Energy Management,NULL,Energy Management,3,Energy Management,NULL,,NULL,1,NULL,NULL,NULL,NULL,NULL,NULL,2,"R2B R3A "
64,Energy Management and Control Systems (EMCS) (Installation Level),Install/Expand Energy Management and Control Systems (Including Data Logging),Rapid response time and sustainment of an installation’s critical loads must be consistent. An EMCS allows monitoring and control of energy systems at the installation level at every major facility and can enhance response time to system issues and increase sustainment time by curtailing noncritical loads.,Installation,Energy Management,NULL,Energy Management,3,Energy Management,NULL,NULL,NULL,NULL,NULL,NULL,NULL,1,NULL,NULL,3,"R1A R3A R4B "
65,Submetering on Power Systems (Installation Level),Install Submetering on Power Systems (Installation Level),Power systems should be able to consistently sustain building energy demands. Monitoring a building’s energy system performance allows localized response to issues and optimization opportunities. This strategy identifies equipment that is compromised and resources whose consumption could be reduced. This strategy focuses on power monitoring at an installation level (master meters) and building-level meters across installation facilities.,Installation,Energy Management,NULL,Energy Management,2,Energy Management,NULL,NULL,NULL,NULL,NULL,NULL,NULL,1,NULL,NULL,3,"R1A R3A R4B "
66,Electrical Energy Storage (Building Level),Install Energy Storage (Building Level),"Buildings are subject to an outage during unpredictable events. Having the capability to store electrical energy (e.g., battery backup) at the building level can provide power during an outage and reduce the peak demand of the facility during “blue-sky” conditions. Backup power can help the facility sustain critical operations and extend the fuel supply for backup generators. Reducing peak demand can reduce utility energy costs and lower the peak design requirements for facility infrastructure.",Building,Energy Storage,NULL,Energy Storage,3,Energy Storage,,,NULL,1,NULL,1,NULL,NULL,NULL,NULL,3,"R2B R3A R3B "
67,Fuel Storage Capacity (Building Level),Add/Increase Fuel Storage Capacity (Building Level),"In a widespread and prolonged outage, the installation may face constrained refueling of generators. Ensuring adequate on-site storage of fuel (in most cases diesel) can help the facility sustain power supply during prolonged outages and when there are potential shortages in diesel supply.",Building,Energy Storage,NULL,Increased System Capacity,3,Increased System Capacity,,,NULL,1,NULL,1,NULL,NULL,NULL,NULL,2,"R2B R3B "
68,Electrical Energy Storage (District Level),Install Energy Storage (District Level),"Providing backup power at a district level may serve more facilities more effectively than providing backup power at the building level. If the district-level electrical infrastructure is configured appropriately, installing battery energy storage at a district substation to serve a group of buildings at the district level can be a more effective way to supply backup power than at the building level. For example, an energy storage system can provide backup power to a district substation and energize all feeds served by that substation from a single location.",District,Energy Storage,NULL,Energy Storage,3,Energy Storage,,,NULL,1,NULL,1,NULL,NULL,NULL,NULL,3,"R2B R3A R3B "
69,Centralized Fuel Storage Capacity (District Level),Add/Increase Centralized Fuel Storage Capacity (District Level),"Diesel fuel storage may be appropriate for districts that are pursuing backup generation at the district level. Installing district-level storage can be an effective supplement to installation-level fuel storage and provide additional sustainment capacity to facilities during a widespread and/or prolonged outage. This strategy can be particularly effective, for example, in a district with facilities with high backup power loads, high diesel consumption rates, and/or off-base diesel refueling contracts.",District,Energy Storage,NULL,Increased System Capacity,3,Increased System Capacity,,,NULL,1,NULL,1,NULL,NULL,NULL,NULL,2,"R2B R3B "
70,Centralized Heating Fuel Storage Capacity (Installation Level),Add/Increase Centralized Heating Fuel Storage Capacity (Installation Level),"Fuel supply that originates off base may be cut off during an outage. An installation-level backup heating fuel supply during a regional outage at bases where heating is a critical energy demand can increase the sustainment period. Increasing on-site storage can mitigate supply availability risk and can be accomplished at an installation level by, for example, installing one or more storage tanks at a location that is accessible by all critical facilities.",Installation,Energy Storage,NULL,Centralized Systems,3,Centralized Systems,,,NULL,NULL,NULL,1,NULL,NULL,NULL,NULL,1,"R3B "
71,Electrical Energy Storage (Installation Level),Install Energy Storage (Installation Level),"Installing electrical energy storage at a primary substation can serve the entire installation. If the electrical infrastructure is configured appropriately, battery energy storage at the installation level can be a more effective way to supply backup power than at the building level and can also be used for demand management during normal operations and to provide cost savings. This strategy can be operationalized for load balancing and islanding by adding Strategy 127 (Installation Microgrid).",Installation,Energy Storage,NULL,Energy Storage,3,Energy Storage,,,NULL,1,NULL,1,NULL,NULL,NULL,NULL,3,"R2B R3A R3B "
72,Centralized Fuel Storage Capacity (Installation Level),Add/Increase Centralized Fuel Storage Capacity (Installation Level),"Fuel supply, including diesel, propane, and LNG, that originates off base can be disrupted during a regional event. Sustaining the power supply from backup generators in an extended outage requires a steady supply of fuel (in most instances diesel). Increasing on-site fuel storage can mitigate supply availability risk and can be accomplished at an installation level by, for example, installing one or more storage tanks at a location that is accessible for all critical facilities.",Installation,Energy Storage,NULL,Increased System Capacity,3,Increased System Capacity,,,NULL,1,NULL,1,NULL,NULL,NULL,NULL,2,"R2B R3B "
73,Alternate/Renewable Energy Generation (Building Level),Install Alternative/Renewable Energy Generation (Building Level),"Traditional energy sources (e.g., diesel, gas, coal) rely on supply chains and may be subject to failure. Alternate/renewable energy reduces reliance on upstream supply chains and can continue to provide electricity even when there is a disruption to the conventional supply. Installing alternate/‌‌renewable energy at the building level can help improve facility sustainment capacity for critical loads and offset reliance on diesel supply. Additionally, alternate/renewable energy can lower utility energy costs for the installation. Examples of building-level alternate/renewable energy are solar photovoltaic (PV) and fuel cells. Operationalizing energy generation for load balancing and islanding is captured in Strategies 116 and 127 (District Microgrid and Installation Microgrid, respectively).",Building,Energy Supply,NULL,Alternative System or Fuel,3,Alternative System or Fuel,,,NULL,1,NULL,NULL,NULL,1,NULL,NULL,2,"R2B R4B "
74,Alternate/Renewable Energy Generation (District Level),Install Alternative/Renewable Energy Generation (District Level),"Traditional energy sources (e.g., diesel, natural gas, coal) rely on supply chains and may be subject to failure. Alternate/renewable energy reduces reliance on upstream supply chains. Configuring district-level electrical infrastructure allows alternate/renewable energy to help power the entire district during a grid power outage, reducing reliance on diesel supply for critical power loads, and lowering utility energy costs for the installation. Examples of district-level alternate/renewable energy are solar PV, fuel cells, waste-to-energy plants, wind turbines, and combined heat and power. Operationalizing energy generation for load balancing and islanding is captured in Strategies 116 and 127 (District Microgrid and Installation Microgrid, respectively).",District,Energy Supply,NULL,Alternative System or Fuel,3,Alternative System or Fuel,,,NULL,1,NULL,NULL,NULL,1,NULL,NULL,2,"R2B R4B "
75,Alternate/Renewable Energy Generation (Installation Level),Install Alternative/Renewable Energy Generation (Installation Level),"Traditional energy sources (e.g., diesel, gas, coal) rely on supply chains and may be subject to failure. Installing alternate/renewable energy offsets reliance on upstream supply chains. Additionally, alternate/renewable energy can lower utility energy costs for the installation. Examples of installation-level alternate/renewable energy include solar PV and wind turbines. Operationalizing energy generation for load balancing and islanding is captured in Strategies 116 and 127 (District Microgrid and Installation Microgrid, respectively).",Installation,Energy Supply,NULL,Alternative System or Fuel,3,Alternative System or Fuel,,,NULL,1,NULL,NULL,NULL,1,NULL,NULL,2,"R2B R4B "
76,Redundant Fuel Supply Routes (Installation Level),Establish Redundant Fuel Supply Routes (Installation Level),"If the installation has on-base fuel-supply infrastructure (e.g., pipelines between storage areas), installing redundant on-site fuel supply routes provides an alternate supply path in case the primary supply is disrupted.",Installation,Energy Supply,NULL,Fuel Supply Routes,3,Fuel Supply Routes,,,NULL,NULL,NULL,NULL,NULL,NULL,NULL,NULL,1,"R2A "
77,Alternate Supply Paths (Fuel),Mitigate Single Points of Failure / Loop Lines (Fuel),"A single point of failure in the fuel supply means that failure at one point causes disruption to all demand downstream. This strategy may include, for example, a redundant storage tank, redundant supply pipelines (if present), looped fuel delivery lines, and fuel pumps.",Installation,Energy Supply,NULL,Single Points of Failure,5,Single Points of Failure,NULL,NULL,NULL,NULL,NULL,NULL,NULL,NULL,NULL,NULL,1,"R2A "
78,Alternate Supply Paths (Natural Gas),Mitigate Single Points of Failure / Loop Lines (Gas),"A single point of failure in the natural gas supply means that failure at one point causes disruption to all downstream service. Configuring the gas supply to be able to reroute mitigates the impact of single points of failure. Examples are interconnected systems (i.e., ability to back feed) and looped configuration (i.e., no dead ends).",Installation,Energy Supply,NULL,Single Points of Failure,5,Single Points of Failure,NULL,NULL,NULL,NULL,NULL,NULL,NULL,NULL,NULL,NULL,1,"R2A "
79,Access to Alternate/Renewable Generation during an Outage,Remove Barriers to Alternative On-Site Generation,"Installations may have alternate/renewable energy systems available on site or nearby, but they may not be operated in such a way that allows the installation to use them directly. Removing administrative or technical barriers can allow the full use of existing alternate or renewable on-site generation assets (e.g., establishing agreements and modifying circuits to allow existing utility-owned alternate generation to serve the installation during an outage).",Installation,Energy Supply,NULL,Alternative System or Fuel,3,Alternative System or Fuel,,,NULL,1,NULL,1,NULL,1,NULL,NULL,3,"R2B R3B R4B "
